{
  "id": "TestBible",
  "version": "1.0.0",
  "module_type": "BIBLE",
  "versification": "KJV",
  "language": "en",
  "title": "Test Bible",
  "documents": [
    {
      "id": "GEN",
      "title": "Genesis",
      "order": 1,
      "content_blocks": [
        {
          "id": "GEN.1.1",
          "sequence": 0,
          "text": "In the beginning God created the heaven and the earth."
        },
        {
          "id": "GEN.1.2",
          "sequence": 1,
          "text": "And the earth was without form, and void; and darkness was upon the face of the deep. And the Spirit of God moved upon the face of the waters."
        },
        {
          "id": "GEN.1.3",
          "sequence": 2,
          "text": "And God said, Let there be light: and there was light."
        }
      ]
    }
  ],
  "loss_class": "L0"
}
